{
  "$schema": "./reuse.schema.json",
  "snapshot": "./components.json",
  "status": "proposed",
  "date": "2026-10-22",
  "classes": {
    "element": "Element dependency: the consumer renders the source element (registered by its define entry).",
    "controller": "Shared controller: parts in the consumer's own tree with behaviour from a core controller or collection model.",
    "style": "Shared style module or tokens: the consumer draws the decision from one shared module (no nested element).",
    "slot": "Slot content: the author supplies it; no dependency.",
    "native": "Native element: the platform draws it; no dependency.",
    "independent": "Looks alike, independent: no shared decision.",
    "deferred": "Not classified (data grid, deferred by the owner)."
  },
  "counts": {
    "style": 92,
    "slot": 35,
    "controller": 14,
    "deferred": 11,
    "native": 4,
    "independent": 2,
    "element": 12
  },
  "references": [
    {
      "consumer": "Oddkin/Common/Accordion",
      "consumerId": "160:1558",
      "source": "Oddkin/Icon/chevronDown",
      "sourceId": "159:276",
      "count": 2,
      "class": "style",
      "reason": "The chevronDown affordance glyph is built in and comes from the shared glyph module (one chevron for every disclosure, picker, and submenu)."
    },
    {
      "consumer": "Oddkin/Common/Accordion",
      "consumerId": "160:1558",
      "source": "Oddkin/Icon/chevronRight",
      "sourceId": "159:279",
      "count": 7,
      "class": "style",
      "reason": "The chevronRight affordance glyph is built in and comes from the shared glyph module (one chevron for every disclosure, picker, and submenu)."
    },
    {
      "consumer": "Oddkin/Common/Breadcrumbs",
      "consumerId": "160:1385",
      "source": "Oddkin/Icon/chevronRight",
      "sourceId": "159:279",
      "count": 6,
      "class": "style",
      "reason": "The chevronRight affordance glyph is built in and comes from the shared glyph module (one chevron for every disclosure, picker, and submenu)."
    },
    {
      "consumer": "Oddkin/Common/Breadcrumbs",
      "consumerId": "160:1385",
      "source": "Oddkin/Icon/home",
      "sourceId": "159:315",
      "count": 2,
      "class": "slot",
      "reason": "The home icon is author content inside the first link."
    },
    {
      "consumer": "Oddkin/Common/Breadcrumbs",
      "consumerId": "160:1385",
      "source": "Oddkin/Icon/more",
      "sourceId": "159:300",
      "count": 1,
      "class": "style",
      "reason": "The more glyph is built into the element and comes from the shared glyph module."
    },
    {
      "consumer": "Oddkin/Common/CheckboxGroup",
      "consumerId": "183:2616",
      "source": "Oddkin/Common/checkbox",
      "sourceId": "159:1181",
      "count": 9,
      "class": "slot",
      "reason": "The author places odd-checkbox children; each is form-associated on its own, so no form ownership crosses a shadow boundary; the group adds fieldset semantics, legend, description, and group error."
    },
    {
      "consumer": "Oddkin/Common/CheckboxOption",
      "consumerId": "258:824",
      "source": "Oddkin/Common/checkbox",
      "sourceId": "159:1181",
      "count": 9,
      "class": "style",
      "reason": "An interactive checkbox cannot sit inside role=\"option\"; the option row draws the box and marks from the shared control-indicator module that odd-checkbox uses."
    },
    {
      "consumer": "Oddkin/Common/CheckboxOption",
      "consumerId": "258:824",
      "source": "Oddkin/Icon/close",
      "sourceId": "159:288",
      "count": 9,
      "class": "style",
      "reason": "The close/remove glyph is built in and comes from the shared glyph module."
    },
    {
      "consumer": "Oddkin/Common/CommandItem",
      "consumerId": "182:2340",
      "source": "Oddkin/Icon/file",
      "sourceId": "159:312",
      "count": 3,
      "class": "slot",
      "reason": "Command icons come from the command data (author content)."
    },
    {
      "consumer": "Oddkin/Common/CommandPalette",
      "consumerId": "182:2469",
      "source": "Oddkin/Common/CommandItem",
      "sourceId": "182:2340",
      "count": 6,
      "class": "controller",
      "reason": "Options are parts in the palette's own tree (aria-activedescendant from its input); the collection and active-descendant controller and the option-row styles are shared with listbox and combobox."
    },
    {
      "consumer": "Oddkin/Common/CommandPalette",
      "consumerId": "182:2469",
      "source": "Oddkin/Common/button",
      "sourceId": "159:439",
      "count": 1,
      "class": "slot",
      "reason": "The retry action lives in the palette's status slot (author content)."
    },
    {
      "consumer": "Oddkin/Common/CommandPalette",
      "consumerId": "182:2469",
      "source": "Oddkin/Common/spinner",
      "sourceId": "161:1939",
      "count": 1,
      "class": "style",
      "reason": "The loading indicator is a part drawn by the shared spinner module (one decision with odd-button busy and odd-progress indeterminate)."
    },
    {
      "consumer": "Oddkin/Common/CommandPalette",
      "consumerId": "182:2469",
      "source": "Oddkin/Icon/search",
      "sourceId": "159:297",
      "count": 5,
      "class": "style",
      "reason": "The search glyph is built into the element and comes from the shared glyph module."
    },
    {
      "consumer": "Oddkin/Common/DataGrid",
      "consumerId": "184:4717",
      "source": "Oddkin/Common/GridColumnHeader",
      "sourceId": "184:3822",
      "count": 36,
      "class": "deferred",
      "reason": "Data grid deferred by the owner (2026-10-21): not classified."
    },
    {
      "consumer": "Oddkin/Common/DataGrid",
      "consumerId": "184:4717",
      "source": "Oddkin/Common/GridRow",
      "sourceId": "184:3887",
      "count": 17,
      "class": "deferred",
      "reason": "Data grid deferred by the owner (2026-10-21): not classified."
    },
    {
      "consumer": "Oddkin/Common/DataGrid",
      "consumerId": "184:4717",
      "source": "Oddkin/Common/GridSelection",
      "sourceId": "184:3830",
      "count": 9,
      "class": "deferred",
      "reason": "Data grid deferred by the owner (2026-10-21): not classified."
    },
    {
      "consumer": "Oddkin/Common/DataGrid",
      "consumerId": "184:4717",
      "source": "Oddkin/Common/button",
      "sourceId": "159:439",
      "count": 47,
      "class": "deferred",
      "reason": "Data grid deferred by the owner (2026-10-21): not classified."
    },
    {
      "consumer": "Oddkin/Common/Disclosure",
      "consumerId": "160:1501",
      "source": "Oddkin/Icon/chevronDown",
      "sourceId": "159:276",
      "count": 1,
      "class": "style",
      "reason": "The chevronDown affordance glyph is built in and comes from the shared glyph module (one chevron for every disclosure, picker, and submenu)."
    },
    {
      "consumer": "Oddkin/Common/Disclosure",
      "consumerId": "160:1501",
      "source": "Oddkin/Icon/chevronRight",
      "sourceId": "159:279",
      "count": 2,
      "class": "style",
      "reason": "The chevronRight affordance glyph is built in and comes from the shared glyph module (one chevron for every disclosure, picker, and submenu)."
    },
    {
      "consumer": "Oddkin/Common/Form",
      "consumerId": "183:2919",
      "source": "Oddkin/Common/CheckboxGroup",
      "sourceId": "183:2616",
      "count": 6,
      "class": "slot",
      "reason": "Form is a composition recipe: the author places the checkbox group."
    },
    {
      "consumer": "Oddkin/Common/Form",
      "consumerId": "183:2919",
      "source": "Oddkin/Common/ValidationSummary",
      "sourceId": "183:2622",
      "count": 1,
      "class": "slot",
      "reason": "Form is a composition recipe: the author places the validation summary."
    },
    {
      "consumer": "Oddkin/Common/Form",
      "consumerId": "183:2919",
      "source": "Oddkin/Common/button",
      "sourceId": "159:439",
      "count": 12,
      "class": "slot",
      "reason": "Form is a composition recipe: the author places odd-button; no element depends on it."
    },
    {
      "consumer": "Oddkin/Common/Form",
      "consumerId": "183:2919",
      "source": "Oddkin/Common/input",
      "sourceId": "159:1024",
      "count": 12,
      "class": "slot",
      "reason": "Form is a composition recipe: the author places odd-input."
    },
    {
      "consumer": "Oddkin/Common/GridColumnHeader",
      "consumerId": "184:3822",
      "source": "Oddkin/Icon/chevronDown",
      "sourceId": "159:276",
      "count": 1,
      "class": "deferred",
      "reason": "Data grid deferred by the owner (2026-10-21): not classified."
    },
    {
      "consumer": "Oddkin/Common/GridColumnHeader",
      "consumerId": "184:3822",
      "source": "Oddkin/Icon/chevronUp",
      "sourceId": "159:282",
      "count": 1,
      "class": "deferred",
      "reason": "Data grid deferred by the owner (2026-10-21): not classified."
    },
    {
      "consumer": "Oddkin/Common/GridColumnHeader",
      "consumerId": "184:3822",
      "source": "Oddkin/Icon/sort",
      "sourceId": "159:375",
      "count": 1,
      "class": "deferred",
      "reason": "Data grid deferred by the owner (2026-10-21): not classified."
    },
    {
      "consumer": "Oddkin/Common/GridRow",
      "consumerId": "184:3887",
      "source": "Oddkin/Common/GridCell",
      "sourceId": "184:3803",
      "count": 12,
      "class": "deferred",
      "reason": "Data grid deferred by the owner (2026-10-21): not classified."
    },
    {
      "consumer": "Oddkin/Common/GridRow",
      "consumerId": "184:3887",
      "source": "Oddkin/Common/GridSelection",
      "sourceId": "184:3830",
      "count": 3,
      "class": "deferred",
      "reason": "Data grid deferred by the owner (2026-10-21): not classified."
    },
    {
      "consumer": "Oddkin/Common/GridSelection",
      "consumerId": "184:3830",